3/31/2024 16:33:39,Male,35 - 44,Some College,web developer,6 - 10 years,Software Engineer,"MaxMind, ezCater",Technology/Software Company,4,No,Not applicable/I've never implemented a dark pattern design before,No,n/a,"Ethical considerations, Company culture",Negative,Negative,5,No,,,,,,Yes,"Tools for generating color schemes like Adobe Color, tools for generating CSS for gradients, shadows, etc. No, these tools have not contributed to the implementation of dark patterns in my code.","Adobe Color, color scheme generation, CSS generation, no contribution to DPs","Adobe Color, tools for CSS, no dark pattern","Adobe Color, CSS generation, no dark pattern","color palette generator tools, no dark pattern","Strict adherence to ethical guidelines in UI/UX design, Implementation of industry-wide standards or regulations, Providing education and training on the ethical implications of UI design choices, Encouraging a culture of transparency and accountability within development teams","We have a responsibility to push back on anything that is likely to harm users, and that includes dark patterns","no harm to users, push back",avoid dark pattern,avoid dark pattern,avoid harm,"Yes, there should be regulations around dark patterns. Software can cause real harm to users. For example, dark patterns in social media apps harming the mental health of users. When companies are causing harm to users in the name of profit, regulations are required in order to protect these users.",negative,positive,positive,"regulation needed, harm to users, mental health issues, social media, users protection, for-profit company","user harm, mental health awareness","regulation, harm to users, for-profit company, mental health, awareness",yes
4/2/2024 10:05:52,Female,18 - 24,Bachelor's degree,Student,Less than 1 year,Junior Software Engineer,Garmin,Technology/Software Company,4,No,Not applicable/I've never implemented a dark pattern design before,No,Meeting business goals or targets,"Ethical considerations, Company culture",Very negative,Neutral,4,No,,,,,,Yes,"The tools I have used are mainly tools with templates, like Vue to help more easily design interfaces. They have not contributed to the implementation of dark patterns.","Vue, UI design, no contribution to DPs","Vue, no dark pattern","Vue, UI/UX design, no dark pattern","frontend frameworks, no dark patterns",Implementation of industry-wide standards or regulations,"Software developers have a responsibility to ""do no harm."" This means they should not use dark patterns that could cause addictive behaviors, financial troubles, etc. because these are harmful to the user. Users should use your application because they like it not because they feel forced into it. ","no harm to users, no additive behaviors, no users' financial loss, no forced action","no forced action, 'do no harm', avoid addictive behaviors, avoid financial troubles","avoid dark pattern, addictive behaviors, financial loss","avoid financial loss, avoid harm","I believe their should be some industry regulations particularly when it comes to dark patterns that cause people to spend money. This is dangerous to me both because it hurts people economically, and because of the amount of children with access to technology these days. Children should not be able to accidentally spend money due to dark patterns in apps and games.",negative,positive,positive,"regulation needed, financial loss, gaming, children protection","children, spend money, gaming","regulation, financial loss, gaming, special groups",yes
4/6/2024 13:16:30,Male,45 - 54,Bachelor's degree,Front-end technical architect,Over 10 years,Principal Engineer,Forum One,Technology/Software Company,5,No,,No,Pressure from stakeholders or management,"Ethical considerations, User experience (UX) principles, Company culture",Very negative,Very negative,5,Not Applicable,,,,,,Maybe,,,,,,"Strict adherence to ethical guidelines in UI/UX design, Implementation of industry-wide standards or regulations, Providing education and training on the ethical implications of UI design choices, Encouraging a culture of transparency and accountability within development teams",,,,,,Yes,netural,positive,neutral,regulation needed,,regulation,yes
4/6/2024 13:51:42,Female,45 - 54,Doctoral degree,Professor; former software architect ,Over 10 years,Principal Engineer,Node Digital,"Technology/Software Company, Goverment",5,No,Not applicable/I've never implemented a dark pattern design before,Not Applicable,n/a,"Ethical considerations, User experience (UX) principles",Very negative,Very negative,5,Not Applicable,,,,,,No,,,,,,"Strict adherence to ethical guidelines in UI/UX design, Implementation of industry-wide standards or regulations, Providing education and training on the ethical implications of UI design choices, Encouraging a culture of transparency and accountability within development teams",knowledge of these patterns and ethics issues,"knowledge of dark patterns, knowledge of ethical issues","ethical issue, knowledge of dark pattern","ethical issues, knowledge of dark pattern",knowledge education,"yes because dark patterns are manipulative, ",negative,positive,positive,"regulation needed, manipulations",manipulative,"regulation, manipulation",yes
4/8/2024 19:52:33,Male,35 - 44,Doctoral degree,CTO,Over 10 years,"CTO, Staff+ Level in all areas of the stack","Texture -- previously Extra, Better, Knotel, Spring, SocialRadar, NGP VAN, Amherst College, UMass Amherst","Technology/Software Company, Financial Services, Education, Non-profit Organization",5,No,Not applicable/I've never implemented a dark pattern design before,Yes,"Pressure from stakeholders or management, Meeting business goals or targets","Ethical considerations, Legal compliance, User experience (UX) principles, Company culture",Very negative,Very negative,5,"Yes, and they were addressed","Honestly it's been a long time since I had to deal with them, more recently I have been leading teams where these are not even introduced because we share company culture that they are bad","avoid dark patterns, bad design, company culture",no dark pattern due to company culture,"avoid dark pattern, company culture","details: avoid using dark patterns, company culture",Yes,"Not sure I entirely understand the question, but have used Figma and Sketch","unsure, Figma, Sketch","Figma, Sketch","Figma, Sketch",design tools,"Strict adherence to ethical guidelines in UI/UX design, Implementation of industry-wide standards or regulations, Providing education and training on the ethical implications of UI design choices, Encouraging a culture of transparency and accountability within development teams",They should absolutely raise these concerns and argue against them,"raise concerns, argue against, push back","raise concern, object","raise concern, object to dark pattern",raise concerns,"Yes absolutely, because they are toxic",negative,positive,positive,"regulation needed, toxic",toxic,"regulation, toxic",yes
4/9/2024 11:30:27,Male,18 - 24,Bachelor's degree,Teaching Assistant,Less than 1 year,Junior Software Engineer,,Technology/Software Company,5,No,Not applicable/I've never implemented a dark pattern design before,No,"Pressure from stakeholders or management, Meeting business goals or targets","Ethical considerations, Legal compliance, User experience (UX) principles",Very negative,Negative,5,Not Applicable,,,,,,Yes,I've used Figma for UI design. This tool did not contribute to implementation of dark patterns. I have not implemented dark patterns.,"Figma, UI design, no contribution to DPs","Figma, UI/UX design","Figma, UI/UX design, no dark pattern","design tools, no dark patterns","Strict adherence to ethical guidelines in UI/UX design, Implementation of industry-wide standards or regulations, Providing education and training on the ethical implications of UI design choices, Encouraging a culture of transparency and accountability within development teams",To not implement designs that they themselves would not want to use.,"avoid DPs implementation, designs self-hated","avoid dp they would not like, user experience","avoid dark pattern, desliked designs, user experience",no implementation,"I think there should be some regulations, especially sneaking and obstruction.",netural,positive,neutral,"regulation needed, sneaking, obstruction","sneaking, obstruction","regulation, sneaking, obstruction",yes
4/17/2024 17:54:18,Male,35 - 44,Bachelor's degree,Software engineer,Over 10 years,Principal Engineer,"Brave, Mozilla, Catalyst IT","Technology/Software Company, Non-profit Organization",4,No,Not applicable/I've never implemented a dark pattern design before,No,I have not implemented dark patterns,"Ethical considerations, Company culture",Very negative,Very negative,5,No,,,,,,No,,,,,,"Implementation of industry-wide standards or regulations, Providing education and training on the ethical implications of UI design choices, Encouraging a culture of transparency and accountability within development teams",They must treat users with dignity and respect.,respect users' dignity,give users respect,respect users,customer focus,"Yes. Just like with privacy, for-profit companies will not pay attention to this problem unless there are serious consequences.",negative,positive,positive,"regulation needed, privacy issues, for-profit company","consequences, for-profit companies","regulation, for-profit company, privacy issues",yes but doubt
4/18/2024 10:25:20,Male,18 - 24,Doctoral degree,Phd Student / GTA,1 - 2 years,Software Engineer,"Shopee, Traveloka",Technology/Software Company,3,No,Not applicable/I've never implemented a dark pattern design before,No,-,"Ethical considerations, Legal compliance",Neutral,Negative,4,Not Applicable,,,,,,No,,,,,,"Strict adherence to ethical guidelines in UI/UX design, Implementation of industry-wide standards or regulations, Providing education and training on the ethical implications of UI design choices, Encouraging a culture of transparency and accountability within development teams",,,,,,,,,,,,,
4/18/2024 23:32:24,Male,35 - 44,Bachelor's degree,Software Engineer,Over 10 years,Staff Engineer,Google,Technology/Software Company,5,No,Not applicable/I've never implemented a dark pattern design before,No,I haven't implemented or been pressured to implement dark patterns.,I haven't been asked.,Very negative,Very negative,4,No,,,,,,No,,,,,,Implementation of industry-wide standards or regulations,"We have a responsibility to push back, but we need support so that our companies don't just hire someone less ethical.","push back, companies' support","ethical issues, careful employment, avoid dark pattern","ethical issues, avoid dark pattern, company culture",company support,"Yes, to support ethical developers and UI designers.",positive,positive,positive,"ethical developers, UI designers, support",ethical developers encourage,ethical developers and designers,yes
4/23/2024 8:34:37,Male,25 - 34,High School,Software developer,6 - 10 years,Software Engineer,,"Technology/Software Company, Goverment",5,Yes,"Obstruction - The user encounters obstacles or challenges that impede their ability to successfully accomplish the task or obtain the necessary information, Interface Interference - The user anticipates a clear and predictable presentation of information on the page, but instead, it is concealed, obscured, or disguised, Highlight ""Allow all cookies""",Yes,"Meeting business goals or targets, Company culture","Ethical considerations, Legal compliance, User experience (UX) principles",Negative,Negative,4,"Yes, but they were ignored","1) Highlight an ""allow all cookies"" button, because I do not believe an unaware user wants to allow tracking. 2) Have an ""allow us to send you marketing emails"" checkbox marked by default, as users probably do not want to receive marketing emails.","avoid dark patterns, highlight ""allow all cookies"" button, marketing emails, preselection","cookie consent, tracking, marketing emails, checkbox, preselection","avoid dark pattern, cookie consent, marketing emails, preselection","example: false consent informed, user underaware",Yes,Wave accessibility extension. Never contributed to dark patterns.,"Wave accessibility extension, no contribution to DPs","Wave accessibility extension, no dark pattern","Wave accessibility extension, no dark pattern","accessibility analytics, extension tools, no dark patterns","Strict adherence to ethical guidelines in UI/UX design, Implementation of industry-wide standards or regulations, Providing education and training on the ethical implications of UI design choices, Encouraging a culture of transparency and accountability within development teams",I believe the unethical decisions come from high-ups. I've never met a developer who wants to implement dark patterns for the company they work for.,"high-up decisions, non-developers choices, hard to avoid",decision of dp comes from higher authority,high-up decisions,company support,"I believe it would be beneficial. GRPR for instance is a good thing in my opinion.

Cookie-consent buttons are not there yet, as the guidelines are a bit vague, but with a more specific revision with explicit examples of what is allowed and not allowed would be great.

Enforcing rules will be a bit hard I think, and it is very important that the rules are clear. Current cookie-consent is not good enough.",negative,positive,positive,"gdpr, cookie consent, vague guidelines, clear rules","GDPR, cookie consent, ","GDPR, cookie consent, clear guidelines",yes
4/23/2024 11:45:18,Male,35 - 44,Bachelor's degree,Linux Systems Administrator,6 - 10 years,Software Engineer,,"Technology/Software Company, Manufacturing/Industrial, Non-profit Organization",5,Yes,"Nagging - The user tries to do something, but their efforts are consistently interrupted by other requests to divert their attention to other tasks, Obstruction - The user encounters obstacles or challenges that impede their ability to successfully accomplish the task or obtain the necessary information",Yes,"Pressure from stakeholders or management, Meeting business goals or targets","Ethical considerations, Legal compliance, User experience (UX) principles",Negative,Negative,5,"Yes, and they were addressed",I have stopped several nagging attempts by citing user criticism.,"avoid dark patterns, nagging, user criticism","nagging, avoid dark pattern","avoid dark pattern, nagging",details: avoid using dark patterns,No,"pa11y, no.",pa11y,,pa11y,"accessibility analytics, command-line tool",Implementation of industry-wide standards or regulations,Ethics are in the eye of the beholder and are not consistent across any group of people I have met.,"beholders, non-consistent ethics",ethical boundaries can be subjective ,ethical boundaries can be subjective ,subjective,"Yes. Until we have regulation with real consequences, dark patterns will continue to be prevalent.

I am adding more here, because there was not a general comments section.

This form has at least one dark pattern. Question 1 has a forced checkbox as ""Record ___ as the email to be included with my response"" where question 2 provides an alternative.

An anonymous survey on Google Forms is not anonymous as Google can read all responses. You and your organization may be handling your data ethically, but the user has no guarantee of this and cannot expect Google to do the right thing. The only solution here is host your own survey using software that can be independently audited by third-parties.",negative,positive,positive,"regulation needed, prevalent dark patterns, anonymous form, data collection","consequences, prevalant, preselection, record email, Google ethical?, personal software for survey","regulation, data collection, anonymous form",yes
4/23/2024 12:19:50,Male,35 - 44,Bachelor's degree,Product Designer,3 - 5 years,Software Engineer,,Technology/Software Company,5,Maybe,"Nagging - The user tries to do something, but their efforts are consistently interrupted by other requests to divert their attention to other tasks, Interface Interference - The user anticipates a clear and predictable presentation of information on the page, but instead, it is concealed, obscured, or disguised",Yes,"Pressure from stakeholders or management, Company culture","Ethical considerations, User experience (UX) principles",Very negative,Very negative,5,"Yes, and they were addressed",,,,,,Yes,,,,,,Implementation of industry-wide standards or regulations,,,,,,,,,,,,,
4/25/2024 12:12:22,Non-binary,25 - 34,Bachelor's degree,Software Developer,6 - 10 years,Software Engineer,"MIT, REDCOM, Second Avenue Learning, Brazen, Oracle","Technology/Software Company, Education",5,No,Not applicable/I've never implemented a dark pattern design before,Maybe,Pressure from stakeholders or management,"Ethical considerations, User experience (UX) principles",Very negative,Neutral,5,Maybe,"More often, I have passively refused to implement bad UX rather than directly arguing with management, but when discussed, I have articulated why those patterns are bad for our UX.","avoid dark patterns, bad UX design, discussion with with superiors","avoid dark pattern, UI/UX design","avoid dark pattern, UI/UX design, colleagues discussion","details: avoid using dark patterns, bad UI designs",Yes,A variety of UI libraries.  I haven't used them to implement darkpatterns.,"UI libraries, no contribution to DPs","UI libraries, no dark pattern","UI libraries, no dark pattern","frameworks/libraries, no dark patterns","Implementation of industry-wide standards or regulations, Providing education and training on the ethical implications of UI design choices, Encouraging a culture of transparency and accountability within development teams","I think engineers and designers do have a responsibility to prioritize the well-being of the people who use what we make, including mental health and not taking advantage of ways in which they may be vulnerable.  While individual engineers and designers may stick to our principles, because these requests often come from managers who control whether we stay employed, I don't know how we solve this across the industry without regulation.","priority customer focus, high-up decisions, non-developers choices, hard to avoid, regulation intervention needs","mental health awareness, not take advantage of vulnerability, user experience, instructions from higher authorities","customer focus, high-up decisions, regulation",regulation needed,"Yes.  I think government is woefully behind the times understanding these issues, and frustratingly uncurious about them, so I am pessimistic about things improving, but we need reasonable restrictions on exploiting people in the same way we have for “brick and mortar” businesses or older exploatitative establishments like casinos.",negative,positive,positive,"regulation needed, understanding latency, uncurious, pessimistic of improvement, reasonable restrictions","government, uncurious, pessimistic, 'brick and mortar', exploatitative establishments, casinos","regulation, uncurious, pessimistic, government",yes but doubt
4/25/2024 19:47:20,Male,35 - 44,Master's degree,Software engineer,6 - 10 years,Staff Engineer,Runway,"Technology/Software Company, Financial Services, Medical/Healthcare, Non-profit Organization",4,Maybe,Not applicable/I've never implemented a dark pattern design before,No,Meeting deadlines,"User experience (UX) principles, Company culture",Very negative,Negative,3,Maybe,A related issue is to neglect accessibility guidelines. Then I've argued successfully to follow standards where they exist.,"accessibility guidelines neglection, argue, follow standards",following standards,"follow standards, accessibility guidelines neglected",details: follow standards,Yes,Chrome dev tools give warnings and lighthouse can give some actionable tips.,"Chrome dev tools, Lighthouse, warning notice, actionable tips notice","Chrome dev tools, warnings, lighthouse, actionable tools","Chrome dev tools, warnings, Lighthouse, actionable tools",Chrome DevTools,"Strict adherence to ethical guidelines in UI/UX design, Encouraging a culture of transparency and accountability within development teams, Working closely with designers, they are usually great advocates of users.",A lot! We are the ones that actually implement the designs so we are in a great place to understand the full extent of the impact that ui patterns will have on the users.,knowledge of impact of UI designs on users,"understand the impact of dp, user experience","knowledge of dark pattern, user experience",lots,targeting dark patterns is probably a losing game since they will always come and go. i feel like it's better to focus on industry standards like WCAG. regulation can also be helpful along the lines of: it should be as easy to close an account as it is to open a new account.,negative,negative,neutral,"losing game, industry standards, WCAG, ","industry standards, WCAG, easy to close an account","industry standards, WCAG, user experience",unsure/doubt
4/26/2024 8:29:09,Male,18 - 24,Bachelor's degree,Ms.C. Student,1 - 2 years,Junior Software Engineer,,Technology/Software Company,5,No,Not applicable/I've never implemented a dark pattern design before,No,n.a.,"Ethical considerations, User experience (UX) principles, Company culture",Negative,Very negative,5,Not Applicable,,,,,,No,,,,,,"Strict adherence to ethical guidelines in UI/UX design, Implementation of industry-wide standards or regulations, Providing education and training on the ethical implications of UI design choices","In my opinion, dark patterns have an huge impact on customers' trust about a brand, especially when they are too obvious to perceive, hence it is important to avoid implementing dps.","avoid DPs design, avoid DPs implementation, trust harm of brand ",effects trust on the company,"avoid dark pattern, trust issues",no implementation,I think regulations should be created to enforce good UX and avoiding illegal practices.,netural ,positive,positive,"regulation needed, enforce good UX, avoid illegal practices","UI/UX design, avoid illegal practices","regulation, UI/UX design, avoid illegal practices",yes
4/26/2024 14:34:38,Male,18 - 24,Bachelor's degree,Software Engineer,3 - 5 years,Software Engineer,Varens SoftTech,"Technology/Software Company, Education",3,No,Not applicable/I've never implemented a dark pattern design before,No,None,"Ethical considerations, Legal compliance, User experience (UX) principles, Company culture",Very negative,Very negative,5,Not Applicable,,,,,,Maybe,,,,,,"Strict adherence to ethical guidelines in UI/UX design, Implementation of industry-wide standards or regulations, Providing education and training on the ethical implications of UI design choices, Encouraging a culture of transparency and accountability within development teams",I believe engineers should challenge and call out dark patterns being provided by designer or business requirements and stakeholders.,"push back, client requirements","object to stakeholders, designers etc. ","client requirements, object to dark pattern",raise concerns,"Yes, I believe policies and guidelines are important in the preventions of the use of dark patterns and government regulators forcing companies to adhere to said policies and guidelines could greatly reduce the use of these dark patterns.",netural ,positive,positive,"policies, guidelines, reduce dark patterns","government regulators force comany to policies, be ethical","government, clear guidelines, regulation, avoid dark pattern",yes
4/27/2024 11:29:28,Male,18 - 24,Bachelor's degree,Freelancer,3 - 5 years,Software Engineer,,"Technology/Software Company, Non-profit Organization",5,No,Not applicable/I've never implemented a dark pattern design before,No,Pressure from stakeholders or management,"Ethical considerations, Legal compliance, User experience (UX) principles",Very negative,Very negative,5,Maybe,,,,,,No,,,,,,"Strict adherence to ethical guidelines in UI/UX design, Implementation of industry-wide standards or regulations, Providing education and training on the ethical implications of UI design choices, Encouraging a culture of transparency and accountability within development teams",They should think like what if their loved ones got snitched in by the Dark patterns they developed themselves.,"designs self-hated, relative snitched by DPs",consider the impact thinking of their loved ones,disliked designs,self-reflection,It's a straight out yes. It's good for the Company and also the users.,positive,positive,positive,"regulation needed, benefits company, benefits users",good for company and users,"regulation, benefit users/company",yes
4/29/2024 11:10:56,Male,18 - 24,Bachelor's degree,student,1 - 2 years,Junior Software Engineer,,Technology/Software Company,5,No,Not applicable/I've never implemented a dark pattern design before,No,Pressure from stakeholders or management,"Ethical considerations, Legal compliance",Positive,Very negative,5,Not Applicable,,,,,,Maybe,,,,,,"Implementation of industry-wide standards or regulations, Encouraging a culture of transparency and accountability within development teams","Respect the choices of users, especially the elderly, children and people with difficulties","respect users' dignity, special groups, elderly, children, disabled ","respect user, user experience","respect users, user experience, special groups",minority groups caring,"Yes, beacuse dark pattern are fraudulent practices. Therefore regulations are necessarily needed",negative,positive,positive,"regulation needed, fraudulent practices","fraudulent practices, regulations needed","fraudulent practices, regulations ",yes
